{"approval_sha256":"2940f1d263faa85fcb934169076e73a9967308d89b9dee3fb06e2a384ac73b0a","approved_at":"2026-08-26T01:40:52.433881+00:00","authority":{"commissioning_attachment":true,"deployment_authorized":false,"production_approved":false,"provider_calls":0,"runtime_compilation":false},"manifest_sha256":"d70d3d4d59cba1ad7a12b7120d6016a5422060663164860c4c25114969c06ce1","owner_attestation":"I explicitly requested this bounded public-website capture and authorize its exact hash-bound files to proceed to deterministic owner review, not runtime truth.","package_id":"kp-summit-home-services-website-knowledge-20260826-014045-797ab5","schema_version":"0.1","status":"OWNER_APPROVED_FOR_COMMISSIONING"}
